{
  "schema_version": "1.1.0",
  "old_run_id": "example-flawed-v0.3.0",
  "new_run_id": "example-revised-v0.3.0",
  "old_document_hashes": {
    "manuscript": "9a1248de91fc89eeb93910fef07175167c06f9054a7755fa184b4b1239dbddef"
  },
  "new_document_hashes": {
    "manuscript": "cfabafd5a5d483c72254c4fd6ad0e078ab64be057555e9ec3f050bc95b2016b7"
  },
  "substantive_changes": [
    {
      "document_id": "manuscript",
      "section": "Abstract",
      "change_type": "replace",
      "summary": "manuscript / Abstract: replace",
      "old_text": "We present the first-ever framework for a universal cancer response biomarker.\nOur results prove a causal mechanism of treatment resistance across tissues.\nTranscriptomic similarity establishes mechanistic conservation across cancers.",
      "new_text": "We present a framework for a cancer response biomarker in the studied population.\nOur results suggest an association with treatment resistance across tissues.\nTranscriptomic similarity suggests shared expression patterns across cancers.",
      "interpretation": "Text changed; scientific substance requires manual review."
    },
    {
      "document_id": "manuscript",
      "section": "Availability",
      "change_type": "insert",
      "summary": "manuscript / Availability: insert",
      "old_text": "",
      "new_text": "Code is available at https://example.org/synthetic-code.\nSynthetic data are available at https://example.org/synthetic-data.",
      "interpretation": "Text changed; scientific substance requires manual review."
    },
    {
      "document_id": "manuscript",
      "section": "Discussion",
      "change_type": "replace",
      "summary": "manuscript / Discussion: replace",
      "old_text": "This biomarker should guide therapy selection in all cancer populations.\nThe embedding establishes a mechanistic axis linking every tissue.",
      "new_text": "The intended clinical use would be risk stratification, pending further evaluation.\nThe findings describe a prognostic association rather than differential treatment benefit.",
      "interpretation": "Text changed; scientific substance requires manual review."
    },
    {
      "document_id": "manuscript",
      "section": "Figure Legends",
      "change_type": "replace",
      "summary": "manuscript / Figure Legends: replace",
      "old_text": "Figure 1. ROC curve computed from the test set.\nTable 1. Cell-level comparisons of signature scores.",
      "new_text": "Figure 1. ROC curve computed in the independent external cohort.\nTable 1. Donor-level comparisons of signature scores.",
      "interpretation": "Text changed; scientific substance requires manual review."
    },
    {
      "document_id": "manuscript",
      "section": "Limitations",
      "change_type": "insert",
      "summary": "manuscript / Limitations: insert",
      "old_text": "",
      "new_text": "Platform and response remain confounded in the discovery cohort.\nThis observational design cannot establish causality or conserved regulation.\nClinical utility, calibration, and subgroup stability require further study.",
      "interpretation": "Text changed; scientific substance requires manual review."
    },
    {
      "document_id": "manuscript",
      "section": "Methods",
      "change_type": "replace",
      "summary": "manuscript / Methods: replace",
      "old_text": "We selected the top 100 genes using all samples and response labels before splitting into training and test sets.\nWe tuned hyperparameters using performance on the test set.\nThe same cohort was used for discovery and validation.\n\nCells were treated as independent biological replicates in the t-test.\nWe used the same genes to construct the signature and validate the signature.\nNominal p-values below 0.05 were declared significant across 20,000 genes.",
      "new_text": "We used grouped nested cross-validation with patient-level train/test splits.\nFeature selection was performed only within each training fold using training samples.\nHyperparameters were chosen in inner validation, followed by evaluation on an untouched test set.\nAn independent external cohort of 30 patients was used to evaluate the locked model.\n\nWe aggregated counts into donor-level pseudobulk for differential expression.\nIndependent marker genes were used for signature validation.\nP-values were adjusted with the Benjamini-Hochberg false discovery rate procedure.\nRandom seed 42 was used for splitting and model fitting.\nThe analysis used Python version 3.11 and a pinned requirements.txt.",
      "interpretation": "Text changed; scientific substance requires manual review."
    },
    {
      "document_id": "manuscript",
      "section": "Results",
      "change_type": "replace",
      "summary": "manuscript / Results: replace",
      "old_text": "Our model predicts response with AUROC 0.98 (Figure 1).\nThe signature separates responders from nonresponders with p-value 0.001 (Table 1).\nOur results prove a causal mechanism of resistance based on the observational association.",
      "new_text": "Our model predicts response with AUROC 0.72 and a 95% confidence interval of 0.55 to 0.86 (Figure 1).\nThe signature separates responders from nonresponders with an adjusted p-value of 0.04 (Table 1).\nOur results suggest an association with resistance based on the observational association.\nSensitivity analyses used alternative preprocessing and alternative annotations.\nA clinical-only baseline model reached AUROC 0.69.",
      "interpretation": "Text changed; scientific substance requires manual review."
    }
  ],
  "claims_strengthened": [],
  "claims_weakened": [
    {
      "old_claim_id": "claim-ecca1ed06169",
      "new_claim_id": "claim-024108155529",
      "old_text": "We present the first-ever framework for a universal cancer response biomarker.",
      "new_text": "We present a framework for a cancer response biomarker in the studied population.",
      "summary": "Matched claim has more qualified wording.",
      "evidence": [
        {
          "document_id": "manuscript",
          "block_id": "manuscript-48a71d89af2c-1",
          "section": "Abstract",
          "quote": "We present the first-ever framework for a universal cancer response biomarker.",
          "start": 0,
          "end": 78,
          "relation": "trigger",
          "page": null,
          "line_start": 5,
          "paragraph": null
        },
        {
          "document_id": "manuscript",
          "block_id": "manuscript-93de9f537e1c-1",
          "section": "Abstract",
          "quote": "We present a framework for a cancer response biomarker in the studied population.",
          "start": 0,
          "end": 81,
          "relation": "trigger",
          "page": null,
          "line_start": 5,
          "paragraph": null
        }
      ],
      "matching_confidence": "low"
    },
    {
      "old_claim_id": "claim-009b7a26360c",
      "new_claim_id": "claim-05035c36599e",
      "old_text": "Our results prove a causal mechanism of treatment resistance across tissues.",
      "new_text": "Our results suggest an association with treatment resistance across tissues.",
      "summary": "Matched claim has more qualified wording.",
      "evidence": [
        {
          "document_id": "manuscript",
          "block_id": "manuscript-48a71d89af2c-1",
          "section": "Abstract",
          "quote": "Our results prove a causal mechanism of treatment resistance across tissues.",
          "start": 79,
          "end": 155,
          "relation": "trigger",
          "page": null,
          "line_start": 6,
          "paragraph": null
        },
        {
          "document_id": "manuscript",
          "block_id": "manuscript-93de9f537e1c-1",
          "section": "Abstract",
          "quote": "Our results suggest an association with treatment resistance across tissues.",
          "start": 82,
          "end": 158,
          "relation": "trigger",
          "page": null,
          "line_start": 6,
          "paragraph": null
        }
      ],
      "matching_confidence": "medium"
    },
    {
      "old_claim_id": "claim-e228425676c6",
      "new_claim_id": "claim-d8f7e4fb599b",
      "old_text": "Our results prove a causal mechanism of resistance based on the observational association.",
      "new_text": "Our results suggest an association with resistance based on the observational association.",
      "summary": "Matched claim has more qualified wording.",
      "evidence": [
        {
          "document_id": "manuscript",
          "block_id": "manuscript-7c9f0797fde7-1",
          "section": "Results",
          "quote": "Our results prove a causal mechanism of resistance based on the observational association.",
          "start": 140,
          "end": 230,
          "relation": "trigger",
          "page": null,
          "line_start": 32,
          "paragraph": null
        },
        {
          "document_id": "manuscript",
          "block_id": "manuscript-7e7ce94cfc8d-1",
          "section": "Results",
          "quote": "Our results suggest an association with resistance based on the observational association.",
          "start": 200,
          "end": 290,
          "relation": "trigger",
          "page": null,
          "line_start": 35,
          "paragraph": null
        }
      ],
      "matching_confidence": "medium"
    }
  ],
  "concerns_resolved": [
    {
      "id": "check.batch_platform",
      "summary": "check.batch_platform: a new affirmative reporting cue was found; adequacy is unverified.",
      "evidence": [
        {
          "document_id": "manuscript",
          "block_id": "manuscript-f79ee62de01a-1",
          "section": "Limitations",
          "quote": "Platform and response remain confounded in the discovery cohort.",
          "start": 0,
          "end": 64,
          "relation": "trigger",
          "page": null,
          "line_start": 51,
          "paragraph": null
        }
      ],